Tracy No.,Frank No.,Year-Frank,Full Gothic Type,Author-Frank,Gender-Frank,Title-Frank
,217,1800,Pure or high Gothic/Monastic shocker (terror mode with sentimental elements),"Ker, Ann",f,"ADELINE ST. JULIAN: OR, THE MIDNIGHT HOUR"
,218,1817,Gothified history (terror mode),"Ker, Ann",f,"EDRIC THE FORESTER: OR, THE MYSTERIES OF THE HAUNTED CHAMBER"
,219,1791,Gothified history (terror elements),unsigned,unknown,LADY JANE GREY: AN HISTORICAL TALE
83,220,1816,Gothic roman a clef (terror mode),"Lamb, Caroline",f,GLENARVON
82,221,1823,Orientalized Gothic/roman a clef,"Lamb, Caroline",f,ADA REIS. A TALE
,223,1816,Sentimentalized Gothic (toned-down monastic shocker),"Lancaster, Agnes",f,"THE ABBESS OF VALTIERA: OR, THE SORROWS OF A FALSEHOOD"
,224,1796,Pure or high Gothic (terror mode),"Lansdell, Sarah",f,"MANFREDI, BARON ST. OSMUND: AN OLD ENGLISH ROMANCE"
,225,1798,Turret Gothic (terror mode and Radcliffean procedures),"Lansdell, Sarah",f,"THE TOWER: OR, THE ROMANCE OF RUTHYNE"
,226,1795,Pure or high Gothic (horror mode),"Lathom, Francis",m,THE CASTLE OF OLLADA
87,227,1798,Pure or high Gothic (the supernatural acoustic),"Lathom, Francis",m,"THE MIDNIGHT BELL. A GERMAN STORY, FOUNDED ON INCIDENTS IN REAL LIFE"
89,228,1800,Naturalized Gothic (domestic and sentimental elements),"Lathom, Francis",m,MYSTERY. A NOVEL
85,229,1802,"Pure or high Gothic (quest story, picaresque elements)","Lathom, Francis",m,ASTONISHMENT!!! A ROMANCE OF A CENTURY AGO
,230,1805,"Domestic Gothic (twin theme, Shakespearean names and situations)","Lathom, Francis",m,"THE IMPENETRABLE SECRET, FIND IT OUT!"
88,231,1806,Gothified history (terror mode),"Lathom, Francis",m,"THE MYSTERIOUS FREEBOOTER, OR, THE DAYS OF QUEEN BESS. A ROMANCE"
,232,1807,Gothified history (monastic shocker elements),"Lathom, Francis",m,"THE FATAL VOW: OR, ST. MICHAELS MONASTERY"
90,233,1808,Gothified history (terror mode),"Lathom, Francis",m,"THE UNKNOWN, OR, THE NORTHERN GALLERY. A ROMANCE"
86,234,1820,Pure or high Gothic,"Lathom, Francis",m,"ITALIAN MYSTERIES, OR, MORE SECRETS THAN ONE. A ROMANCE"
,235,1830,"Pure or high Gothic (terror mode, elements of Gothified history)","Lathom, Francis",m,"MYSTIC EVENTS: OR, THE VISION OF THE TAPESTRY, A ROMANTIC LEGEND OF THE DAYS OF ANNE BOLEYN"
,236,1805,Pure or high Gothic (domestic terror),"Lathy, Thomas Pike",m,USURPATION: OR THE INFLEXIBLE UNCLE
91,237,1806,Pure or high Gothic (Schauerromantik elements),"Lathy, Thomas Pike",m,"THE INVISIBLE ENEMY, OR, THE MINES OF WIELITSKA. A POLISH LEGENDARY ROMANCE"
,238,1820,Pure or high Gothic (composite imitation),"Layton, Mrs. Frederick",f,HULME ABBEY
,239,1797,Anthology in five volumes (tales have periodic Gothicism),"Lee, Harriet and Sophia",f,THE CANTERBURY TALES FOR THE YEAR 1797
92,240,1785,Gothified history (terror and sentimental elements),"Lee, Sophia",f,"THE RECESS, OR, A TALE OF OTHER TIMES"
93,241,1800,Gothic chapbook (Shauerromantik elements),"Legge, F.",unknown,"THE SPECTRE CHIEF, OR, THE BLOOD-STAINED BANNER. AN ANCIENT ROMANCE. With THE SPECTRE CHIEF is bound BARON FITZALLAN"
94,242,1797,Didactic and domestic novel (Gothic titling),"Leigh, Sir Samuel Egerton",m,"MUNSTER ABBEY. A ROMANCE, INTERSPERSED WITH REFLECTIONS ON VIRTUE AND MORALITY"
95,243,1762,"Gothified history (historical Gothic prototype, terror elements)","Leland, Thomas",m,"LONGSWORD, EARL OF SALISBURY. AN HISTORICAL ROMANCE"
99,244,1796,"Pure or high Gothic (horror, terror, and Schauerromantik modes, monastic shocker)","Lewis, Matthew",m,THE MONK. A ROMANCE
96,245,1805,Rauberroman (terror mode),"Lewis, Matthew",m,THE BRAVO OF VENICE
102,246,1807,Gothic chapbook (converted from Gothic drama),"Lewis, Matthew",m,"THE WOOD DAEMON, OR, ""THE CLOCK HAS STRUCK"""
100,247,1808,"Gothic anthology (terror, horror, and Schauerromantik modes represented with Germanic translations and imitations)","Lewis, Matthew",m,ROMANTIC TALES
,248,1804,Gothic chapbook,unsigned,unknown,"LEWIS TYRELL: OR, THE DEPRAVED COUNT, INCLUDING THE PATHETICK ADVENTURES AND TRAGICALL HISTORY OF ELLA CLIFFORD AND OSCAR HENRY HAMPDON, AN ENGLISH TALE OF THE FOURTEENTH CENTURY"
,249,1811,Pure or high Gothic (bluebook qualities),"Loney, T.C.",unknown,"SEBASTIAN AND ISABEL: OR, THE INVISIBLE SWORD"
,250,1818,Gothic bluebook (shilling shocker),unsigned,unknown,"LOVEL CASTLE: OR, THE RIGHTFUL HEIR RESTORED, A GOTHIC TALE"
,251,1798,"Marginal Gothic (intermittent terror episodes, picaresque and domestic elements)","Lucas, Charles",m,"THE CASTLE OF ST. DONATS: OR, THE HISTORY OF JACK SMITH"
104,252,1801,"Political and polemical Gothic (satiric and philosophic elements, attack on Godwin and Jacobin novelists)","Lucas, Charles",m,THE INFERNAL QUIXOTE. A TALE OF THE DAY
,253,1801,"Pure or high Gothic (terror mode, monastic shocker elements)",unsigned,unknown,"LUSIGNAN: OR, THE ABBAYE OF LA TRAPPE"
,254,1803,Pure or high Gothic (Schauerromantik elements),"Lyttleton, Mr.",m,THE GERMAN SORCERESS
105,255,1791,Gothified history (terror mode),"Mackenzie, Anna Maria",f,THE DANISH MASSACRE. AN HISTORICAL FACT
,256,1795,Gothified history (terror mode),"Mackenzie, Anna Maria",f,MYSTERIES ELUCIDATED
,257,1798,Pure or high Gothic (Schauerromantik elements),"Mackenzie, Anna Maria",f,"DUSSELDORF: OR, THE FRATRICIDE"
,258,1801,Pure or high Gothic (terror mode),"Mackenzie, Anna Maria",f,"SWEDISH MYSTERIES: OR, THE HERO OF THE MINES OF DELECARLIA"
106,259,1809,Domestic fiction (several Gothic elements and characters),"Mackenzie, Anna Maria",f,"THE IRISH GUARDIAN, OR, ERRORS OF ECCENTRICITY"
,260,1771,Sentimental fiction (settings and feelings appropriate to Gothic romance),"Mackenzie, Henry",m,THE MAN OF FEELING
,261,1777,Epistolary and domestic Gothic (emergent Gothic villain),"Mackenzie, Henry",m,JULIA DE ROUBIGNE
,262,1806,Sentimental Gothic (imitation of Mrs. Radcliffe and Charlotte Smith),"Manners, Mrs",f,"CASTLE NOUVIER: OR, HENRY AND ADELAIDE"
,263,1821,Pure or high Gothic,"Marshall, Thomas",m,"THE IRISH NECROMANCER: OR, DEER PARK"
,264,1807,Sentimental Gothic (imitation of Charlotte Smith’s novels),"Matthews, Charlotte",f,"GRIFFITH ABBEY: OR, THE MEMOIRS OF EUGENIA"
108,265,1807,Pure or high Gothic (terror-horror modes),"Maturin, Charles Robert",m,"FATAL REVENGE, OR, THE FAMILY OF MONTORIO. A ROMANCE"
111,266,1808,Domestic fiction (several touches of terror Gothicism),"Maturin, Charles Robert",m,THE WILD IRISH BOY
110,267,1812,"Pure or high Gothic (terror mode, revolutionary Irish politics)","Maturin, Charles Robert",m,THE MILESIAN CHIEF. A ROMANCE
109,268,1820,"Pure or high Gothic (actually, a composite of Gothic types)","Maturin, Charles Robert",m,MELMOTH THE WANDERER
107,269,1824,Gothified history (terror-horror modes),"Maturin, Charles Robert",m,THE ALBIGENSES. A ROMANCE
,270,1804,Gothic chapbook,unsigned,unknown,"MAXIMILIAN AND SELINA: OR, THE MYSTERIOUS ABBOT, A FLEMISH TALE"
,271,1795,Pure or high Gothic (Radcliffean imitation),"Meeke, Mary",f,THE ABBEY OF CLUGNY
112,272,1795,Domestic Gothic (search for the father),"Meeke, Mary",f,"COUNT ST. BLANCHARD, OR, THE PREJUDICED JUDGE. A NOVEL"
,273,1797,Domestic Gothic (genealogical puzzlements),"Meeke, Mary",f,THE MYSTERIOUS WIFE
,274,1798,Pure or high Gothic (Radcliffean imitation),"Meeke, Mary",f,THE SICILIAN
,275,1801,"Pure or high Gothic (mild terrors, genealogical pleasures)","Meeke, Mary",f,THE MYSTERIOUS HUSBAND
113,276,1802,"Pure or high Gothic (domestic elements, genealogical entanglements)","Meeke, Mary",f,MIDNIGHT WEDDINGS. A NOVEL
114,277,1808,Domestic fiction (intermittent Gothic elements),"Meeke, Mary",f,"""THERE IS A SECRET, FIND IT OUT!"""
,278,1809,Gothified history (Radcliffean effects),"Meeke, Mary",f,LAUGHTON PRIORY
115,279,1819,Domestic fiction (intermittent Gothic effects),"Meeke, Mary",f,"THE VEILED PROTECTRESS, OR, THE MYSTERIOUS MOTHER. A NOVEL"
,280,1802,"Pure or high Gothic (terror mode, chapbook quality)","Melville, Theodore",m,"THE WHITE KNIGHT: OR, THE MONASTERY OF THE MORNE"
,281,1807,"Pure or high Gothic (terror mode, imitation of Maturin’s THE FATAL REVENGE)","Melville, Theodore",m,"THE BENEVOLENT MONK: OR, THE CASTLE OF OLALLA"
,282,1802,Periodical Gothic thriller (chapbook quality),unsigned,unknown,"THE MIDNIGHT ASSASSIN: OR, THE CONFESSIONS OF THE MONK RINALDI"
116,283,1808,Gothic bluebook (variable plagiarism from many Gothics),unsigned,unknown,"THE MIDNIGHT GROAN: OR, THE SPECTRE OF THE CHAPEL"
,284,n.d.,Gothic chapbook (compilation of cases involving spectral appearances),unsigned,unknown,"THE MIDNIGHT MONITOR: OR, SOLEMN WARNINGS FROM THE INVISIBLE WORLD"
,285,1805,Gothified history (terror mode),"Millikin, Anna",f,"THE RIVAL CHIEFS: OR, THE BATTLE OF THE MERE"
,286,1817,Gothic bluebook (imitation of chapbook reductions of THE MONK),unsigned,unknown,THE MONK OF HENNARES
,287,1800,Gothified translation (from a French romance by Charles-Antoine-Guilaume Pigault-Lebrun (1753-1835),unsigned,unknown,"THE MONK OF THE GROTTO: OR, EUGENIO AND VIRGINIA"
,288,1807,Gothic chapbook,unsigned,unknown,"THE MONKS OF CLUGNY: OR, CASTLE-ACRE MONASTERY"
,289,1806,Pure or high Gothic (terror mode),"Montague, Edward",m,THE CASTLE OF BERRY-POMEROY
,290,1807,Pure or high Gothic (elements of the monastic shocker and Ireland’s THE ABBESS),"Montague, Edward",m,LEGENDS OF A NUNNERY: A ROMANTIC LEGEND
117,291,1807,"Pure or high Gothic (monastic shocker, excessive natural and supernatural horror)","Montague, Edward",m,THE DEMON OF SICILY
,292,1796,Gothified history,unsigned,unknown,"MONTFORD CASTLE: OR, THE KNIGHT OF THE WHITE ROSE, AN HISTORICAL ROMANCE OF THE ELEVENTH CENTURY"
,293,1799,Romance of the ruin (terror mode),unsigned,unknown,"MONTROSE: OR, THE GOTHIC RUIN"
,294,1817,Gothified history (terror mode),"Moore, George",m,THE MYSTERIES OF HUNGARY: A ROMANTIC HISTORY OF THE FIFTEENTH CENTURY
118,295,1797,"Pure or high Gothic (terror mode, in serialized form)","Moore, George",m,GRASVILLE ABBEY. A ROMANCE
119,296,1802,Pure or high Gothics (a multiple Gothic containing elements of several subspecies of Gothic fiction) ,"Moore, George",m,"THEODOSIUS DE ZULVIN, THE MONK OF MADRID. A SPANISH TALE, DELINEATING VARIOUS TRAITS OF THE HUMAN MIND"
120,297,1789,Novel of domestic sadism (titular character is a prototypical Gothic villain),"Moore, John",m,"ZELUCO. VARIOUS VIEWS OF HUMAN NATURE, TAKEN FROM LIFE, AND MANNERS, FOREIGN AND DOMESTIC"
,298,1805,Pure or high Gothic (terror mode),"Morley, G.T.",unknown,"DEEDS OF DARKNESS: OR, THE UNNATURAL UNCLE"
,299,1798,Pure or high Gothic (Radcliffean imitation),unsigned,unknown,MORT CASTLE: A GOTHIC STORY
,300,1793,"Pure or high Gothic (Otrantoesque terror, horror modes)",unsigned,unknown,MORTIMORE CASTLE: A CAMBRIAN TALE
,301,1797,Gothified history (imitation of OTRANTO),"Musgrave, Agnes",f,EDMUND OF THE FOREST: AN HISTORICAL NOVEL
,302,1798,Pure or high Gothic (terror mode),"Musgrave, Agnes",f,THE SOLEMN INJUNCTION
,303,1800,"Gothic bluebook (terror, horror modes)",unsigned,unknown,"THE MYSTERIOUS BRIDE: OR, THE STATUE SPECTRE"
,304,1800,Pure or high Gothic (Radcliffean imitation),unsigned,unknown,"THE MYSTERIOUS PENITENT: OR, THE NORMAN CHATEAU, A ROMANCE"
,305,n.d.,Gothic chapbook,unsigned,unknown,THE MYSTERY OF THE BLACK CONVENT: AN INTERESTING SPANISH TALE OF THE ELEVENTH CENTURY
,306,1808,Pure or high Gothic (imitation of Lathom’s Gothic thrillers),unsigned,unknown,MYSTERY UPON MYSTERY: A TALE OF EARLIER TIMES
,307,1800,Gothic chapbook,unsigned,unknown,"THE MYSTIC TOWER: OR, VILLAINY PUNISHED"
,308,1802,Pure or high Gothic (plotting taken from Reeve’s OLD ENGLISH BARON),unsigned,unknown,"NEVILLE CASTLE: OR, THE GENEROUS CAMBRIANS"
,309,1789,Pure or high Gothic (horror mode),"Nicholson, Mr.",m,THE SOLITARY CASTLE: A ROMANCE OF THE EIGHTEENTH CENTURY
,310,1812,Gothified history,Nubilia,unknown,THE CASTLE OF GLENROICH: A ROMANCE OF THE TWELFTH CENTURY
,311,1809,Pure or high Gothic (imitation of THE MONK),Orlando,unknown,"THE CHAMBER OF DEATH: OR, THE FATE OF ROSARIO, AN HISTORICAL ROMANCE OF THE SIXTEENTH CENTURY"
,312,1806,Pure or high Gothic (some philosophical content),"Owenson, Sydney (Lady Morgan)",f,THE NOVICE OF ST. DOMINICK
,313,1806,Pure or high Gothic (didactit and nationalistic elements),"Owenson, Sydney (Lady Morgan)",f,THE WILD IRISH GIRL
,314,1802,"Gothified history (terror mode, Macbethian overtones)",F.H.P.,unknown,THE CASTLE OF CAITHNESS: A ROMANCE OF THE THIRTEENTH CENTURY
122,315,1796,"Grotto Gothic (horror mode, elements of Gothified history)","Palmer, John, Jr.",m,THE HAUNTED CAVERN. A CALEDONIAN TALE
123,316,1796,Tower Gothic (elements of Gothified history),"Palmer, John, Jr.",m,THE MYSTERY OF THE BLACK TOWER. A ROMANCE
,317,1807,Pure or high Gothic (terror mode),"Palmer, John, Jr.",m,"THE MYSTIC SEPULCHRE: OR, SUCH THINGS HAVE BEEN, A SPANISH ROMANCE"
,318,1807,Gothic bluebook,unsigned,unknown,"PARENTAL MURDER: OR, THE BROTHERS, AN INTERESTING ROMANCE IN WHICH VIRTUE AND VILLAINY ARE CONTRASTED, AND FOLLOWED BY REWARD AND RETRIBUTION"
125,319,1793,"Pure or high Gothic (Germanic and Schauerromantik elements, sham translation)","Parsons, Eliza",f,CASTLE OF WOLFENBACH. A GERMAN STORY
127,320,1796,"Pure or high Gothic (terror mode, explained supernatural)","Parsons, Eliza",f,THE MYSTERIOUS WARNING. A GERMAN TALE
124,321,1798,Gothic parody (some serious motifs mixed with satire on the Gothic heroine),"Parsons, Eliza",f,ANECDOTES OF TWO WELL-KNOWN FAMILIES
,322,1799,Domestic Gothic (terror mode),"Parsons, Eliza",f,THE VALLEY OF ST. GOTHARD
,323,1802,Domestic novel (only slightly Gothic),"Parsons, Eliza",f,THE MYSTERIOUS VISIT: A NOVEL FOUNDED ON FACTS
128,324,1798,"Pure or high Gothic (artificial terror, numerous elements of Gothic parody)","Patrick, Mrs. F. C.",f,MORE GHOSTS!
,325,1816,Gothic parody (also satirizes other romantic attitudes toward nature and architecture),"Peacock, Thomas Love",m,HEADLONG HALL
,326,1818,Gothic Parody,"Peacock, Thomas Love",m,NIGHTMARE ABBEY
,327,1831,Gothic parody,"Peacock, Thomas Love",m,CROTCHET CASTLE
,328,1805,Sentimental Gothic (Radcliffean landscapes),"Picard, Mary",f,"THE CASTLE OF ROVIEGO: OR, RETRIBUTION"
129,329,1803,"Pure or high Gothic (elements of THE MONK, monster story, transformation motif)","Pickersgill, Joshua, Jr.",m,THE THREE BROTHERS. A ROMANCE
,330,1814,Sentimental Gothic (Radcliffean imitation),"Pilkington, Mary",f,"THE NOVICE: OR, THE HEIR OF MONTGOMERY CASTLE"
,331,1798,Sentimental and Grotto Gothic,"Pilkington, Miss",f,"THE SUBTERRANEAN CAVERN: OR, THE MEMOIRS OF ANTOINETTE DE MONFLORANCE"
,332,1802,Pure or high Gothic (terror and sentimental elements),"Pilkington, Miss",f,"THE ACCUSING SPIRIT: OR, DE COURCY AND EGLANTINE"
131,333,1819,Prototypical Vampire Tale (Gothic characterization and scenery),"Polidori, John William",m,THE VAMPYRE. A TALE
130,334,1819,Natural Gothic horror (uses incest motif),"Polidori, John William",m,"ERNESTUS BERCHTOLD, OR, THE MODERN OEDIPUS. A TALE"
,335,1818,Gothified history,"Porter, Anna Maria",f,THE FAST OF ST. MAGDALEN
132,336,1822,Gothified history,"Porter, Anna Maria",f,"ROCHE-BLANCHE, OR, THE HUNTERS OF THE PYRENEES. A ROMANCE"
,337,1802,Historical fiction (periodic Gothic elements),"Porter, Jane",f,THADDEUS OF WARSAW
,338,1810,Historical novel (intermittent Gothic elements),"Porter, Jane",f,THE SCOTTISH CHIEFS
,339,1806,"Pure or high Gothic (Schauerromantik elements, free translation from Veit Weber)","Powell, James",m,"WOLF: OR, THE TRIBUNAL OF BLOOD"
,340,1788,"Pure or high Gothic (terror mode, satiric elements in the early chapters)",unsigned,unknown,"POWIS CASTLE: OR, ANECDOTES OF AN ANTIENT FAMILY"
,341,n.d.,Gothic chapbook,unsigned,unknown,THE PRIORY OF ALBA AND THE CASTLE ON THE CLIFFS: A ROMANCE OF ANCIENT TIMES
,342,1799,Pure or high Gothic (terror mode),"Proby, William Charles",m,THE MYSTERIOUS SEAL
,343,1800,"Pure or high Gothic (terror mode, Radcliffean imitation)","Proby, William Charles",m,THE SPIRIT OF THE CASTLE
,344,1800,Gothic chapbook (terror mode),unsigned,unknown,"THE PROPHETIC WARNING: OR, THE CASTLE OF LINDENDORFF"
,345,1794,Sham translation (Schauerromantik elements),C. R.,unknown,CASTLE ZITTAW: A GERMAN TALE
133,346,1789,Pure or high Gothic (terror mode),"Radcliffe, Ann",f,THE CASTLES OF ATHLIN AND DUNBAYNE
138,347,1790,Pure or high Gothic (terror mode),"Radcliffe, Ann",f,A SICILIAN ROMANCE
137,348,1791,Pure or high Gothic (terror mode),"Radcliffe, Ann",f,THE ROMANCE OF THE FOREST
136,349,1794,Pure or high Gothic (terror mode),"Radcliffe, Ann",f,THE MYSTERIES OF UDOLPHO. A ROMANCE
135,350,1797,Pure or high Gothic (terror and horror modes),"Radcliffe, Ann",f,"THE ITALIAN, OR, THE CONFESSIONAL OF THE BLACK PENITENTS. A ROMANCE"
134,351,1826,Gothified history (authentic supernatural elements),"Radcliffe, Ann",f,"GASTON DE BLONDEVILLE, OR, THE COURT OF HENRY III. KEEPING FESTIVAL IN ARDENNE"
139,352,1809,"Pure or high Gothic (imitation of the ""first"" Mrs. Radcliffe)","Radcliffe, Mary Ann",f,"MANFRONÉ, OR, THE ONE-HANDED MONK"
,353,1808,Pure or high Gothic (Radcliffean imitation),Ratcliffe Eliza,f,THE MYSTERIOUS BARON
,354,1809,Gothic chapbook,unsigned,unknown,"THE RECLUSE OF THE WOODS: OR, THE GENEROUS WARRIOR, A GOTHIC ROMANCE"
141,355,1777,Gothified history (subdued supernatural and domesticated Gothic),"Reeve, Clara",f,THE OLD ENGLISH BARON
143,356,1783,Sentimental fiction (intermittent Gothic elements),"Reeve, Clara",f,THE TWO MENTORS. A MODERN STORY
140,357,1788,Sentimental fiction (intermittent Gothic elements),"Reeve, Clara",f,"THE EXILES, OR, MEMOIRS OF THE COUNT DE CRONSTADT"
142,358,1791,Sentimental fiction (intermittent Gothic elements),"Reeve, Clara",f,THE SCHOOL FOR WIDOWS. A NOVEL
144,359,1807,Domestic fiction (has Gothic elements and bears a Gothic title),"Reeve, Sophia",f,THE MYSTERIOUS WANDERER
145,360,1792,Sentimentalized Gothic (uses the motif of the mysterious key),"Robinson, Mary",f,"VACENZA, OR, THE DANGERS OF CREDULITY"
,361,1796,Pure or high Gothic (Radcliffean imitation),"Robinson, Mary",f,HUBERT DE SEVRAC: A ROMANCE OF THE EIGHTEENTH CENTURY
146,362,1810,Domestic fiction (various Gothic elements),"Roche, John Hamilton",m,"A SUFFOLK TALE, OR, THE PERFIDIOUS GUARDIAN"
153,363,1793,Sentimentalized Gothic (numerous Radcliffean echoes and elements),"Roche, Regina Maria",f,THE MAID OF THE HAMLET. A TALE
149,364,1796,Sentimentalized Gothic (intermittent Radcliffean elements),"Roche, Regina Maria",f,THE CHILDREN OF THE ABBEY. A TALE
150,365,1798,Pure or high Gothic (terror mode),"Roche, Regina Maria",f,CLERMONT. A TALE
154,366,1800,Domestic Gothic (numerous sentimental elements),"Roche, Regina Maria",f,NOCTURNAL VISIT. A TALE
152,367,1807,Domestic Gothic (various terror elements),"Roche, Regina Maria",f,"THE DISCARDED SON, OR, HAUNT OF THE BANDITTI. A TALE"
,368,1810,Sentimentalized Gothic (some components of the monastic shocker),"Roche, Regina Maria",f,"THE HOUSES OF OSMA AND ALMERIA: OR, CONVENT OF ST. IDLEFONSO"
,369,1813,Sentimentalized Gothic (some terror elements),"Roche, Regina Maria",f,THE MONASTERY OF ST. COLUMB: OR THE ATONEMENT
148,370,1825,Semi-Domestic Gothic (Radcliffean scenery and elements),"Roche, Regina Maria",f,THE CASTLE CHAPEL. A ROMANTIC TALE
151,371,1828,Sentimental fiction (residual or secondary Gothic elements),"Roche, Regina Maria",f,CONTRAST
,372,1792,Medieval Quest Gothic (Spenserian Gothic),unsigned,unknown,"THE ROCK OF MODREC: OR, THE LEGEND OF SIR ELTRAM, AN ETHICAL ROMANCE TRANSLATED FROM AN ANCIENT BRITISH MANUSCRIPT LATELY DISCOVERED AMONG THE RUINS OF AN ABBEY"
155,373,1808,Rauberroman (Radcliffean and Shakespearean elements),unsigned,unknown,THE ROMANCE OF THE APPENNINES
,374,1811,Pure or high Gothic (terror and sentimental elements),unsigned,unknown,"ROSALIE: OR, THE CASTLE OF MONTALABRETTI"
157,375,1813,Fake Gothic (a sentimental and social novel under a Gothic title),"Ross, Mrs.",f,"THE MARCHIONESS!!! OR, ""THE MATURED ENCHANTRESS"""
,376,1813,Domestic Gothic,"Ross, Mrs.",f,"THE STRANGERS OF LINDENFELDTH: OR, WHO IS MY FATHER?"
,377,1804,Gothified history (imitation of Rochean Gothicism),"Rouviere, Henrietta",f,LUSSINGTON ABBEY
,378,1816,Gothified history (terror elements),"Rouviere, Henrietta",f,CRAIG MELROSE ABBEY
,379,1788,Picaresque fantasy (intermittent Gothic elements),"Rowson, Susanna Haswell",f,"THE INQUISITOR: OR, INVISIBLE RAMBLER"
,380,1813,Romance of the ruin (terror mode),unsigned,unknown,"THE RUINS OF SELINUNTI: OR, THE VAL DE MAZZARA, SICILIAN, CALABRIAN, AND NEAPOLITAN SCENERIES BY A LATE RAMBLER IN THOSE COUNTRIES"
,381,1800,Romance of the Ruin (horror mode),unsigned,unknown,THE RUINS OF ST. OSWALD
,382,1822,Sentimental Gothic,"Russell, John",m,THENUN OF ARROUCA: A TALE
,383,1798,Gothic parody,"R. S., esq",m,THE NEW MONK
,384,1808,Romance of the ruin (terror mode),"Saint Victor, Helen",f,"THE RUINS OF RIGONDA: OR, THE HOMICIDAL FATHER"
,385,1798,"Serialized Gothic (terror mode, Radcliffean elements)",unsigned,unknown,"SCHABRACO, A ROMANCE"
,386,1788,Sentimental fiction (features from Mackenzie’s MAN OF FEELING),unsigned,unknown,"THE SCHOOL FOR FATHERS: OR, THE VICTIM OF A CURSE"
,387,1814,Pure or high Gothic (Radcliffean imitation),"Scott, Honoria",f,THE CASTLE OF STRATHMAY: A TALE
,388,1816,Historical fiction (elements of Gothic characterization and scenery),"Scott, Sir Walter",m,THE BLACK DWARF
,389,1819,Historical fiction (salient Gothic traits),"Scott, Sir Walter",m,THE BRIDE OF LAMMERMOOR
,390,1819,Historical fiction (varieties of Gothic characterization and monastic locale),"Scott, Sir Walter",m,THE ABBOT
,391,1820,Historical fiction (prominent Gothic influences in scenery and characterization),"Scott, Sir Walter",m,THE MONASTERY
,392,1821,"Historical fiction (substantial Gothic residue, especially the persecuted maiden)","Scott, Sir Walter",m,KENILWORTH
,393,1802,Gothic Chapbook,unsigned,unknown,"THE SECRET OATH: OR, BLOOD-STAINED DAGGER"
,394,1803,Gothic bluebook (plagiarized abridgement of several novels of the secret Fehmic Court),unsigned,unknown,"THE SECRET TRIBUNAL: OR, THE COURT OF WINCELAUS, A MYSTERIOUS TALE"
,395,1797,Pure or high Gothic (Radcliffean imitation),"Selden, Catherine",f,THE COUNT DE SANTERRE: A ROMANCE
,396,1797,"Pure or high Gothic (elements of the monastic shocker, influence of Diderot’s LA RELIGIEUSE)","Selden, Catherine",f,THE ENGLISH NUN
,397,1805,Pure or high Gothic (Radcliffean imitation),"Selden, Catherine",f,"VILLA NOVA: OR, THE RUINED CASTLE"
,398,1789,Sentimental Gothic (imitation of Reeve’s OLD ENGLISH BARON),unsigned,unknown,"SEYMOUR CASTLE: OR, THE HISTORY OF JULIA AND CECILIA"
161,399,1818,Philosophical Gothic (sometimes categorized as primitive science fiction),"Shelley, Mary",f,"FRANKENSTEIN, OR, THE MODERN PROMETHEUS"
165,400,1823,Gothified history (uses the castle tyrant as its main character),"Shelley, Mary",f,"VALPERGA, OR, THE LIFE AND ADVENTURES OF CASTRUCCIO, PRINCE OF LUCCA"
162,401,1826,Apocalyptic Gothic (futuristic science fiction),"Shelley, Mary",f,THE LAST MAN
160,402,1830,Gothified history,"Shelley, Mary",f,THE FORTUNES OF PERKIN WARBECK. A ROMANCE
163,403,1835,Domestic fiction (recessive Gothic traits),"Shelley, Mary",f,LODORE
167,404,1810,Pure or high Gothic (Schauerromantik features and characters),"Shelley, Percy",m,ZASTROZZI. A ROMANCE
166,405,1811,Pure or high Gothic (Schauerromantik features and characters),"Shelley, Percy",m,"ST. IRVYNE, OR, THE ROSICRURIAN. A ROMANCE"
,406,1802,Gothic chapbook (composite plagiarism),unsigned,unknown,"SHREWTZER CASTLE: OR, THE PERFIDIOUS BROTHER, A GERMAN ROMANCE INCLUDING THE PATHETIC TALE OF EDMUND’S GHOST"
,407,1798,Pure or high Gothic (imitation of OTRANTO and other first Gothics),"Sickelmore, Richard",m,"EDGAR: OR, THE PHANTOM OF THE CASTLE"
168,408,1800,Pure or high Gothic (elements of THE MONK's loathsome descriptions),"Sickelmore, Richard",m,MARY JANE. A NOVEL
,409,1805,"Pure or high Gothic (romance of the ruin, numerous Radcliffean elements)","Sickelmore, Richard",m,"RASHLEIGH ABBEY: OR, THE RUIN ON THE ROCK"
,410,1809,Pure or high Gothic (journalistic format),"Sickelmore, Richard",m,"OSRICK: OR, MODERN HORRORS, A ROMANCE INTERSPERSED WITH A FEW ANECDOTES, ETC. THAT HAVE THEIR FOUNDATIONS IN TRUTH"
,411,1791,Gothified history,"Siddons, Henry",m,"WILLIAM WALLACE: OR, THE HIGHLAND HERO, A TALE FOUNDED ON HISTORICAL FACTS"
,412,1803,Räuberroman (various Radcliffean elements),"Siddons, Henry",m,REGINALD DE TORBY AND THE TWELVE ROBBERS
169,413,1809,Domestic Gothic (apparitional visitations),"Siddons, Henry",m,THE SON OF THE STORM. A TALE
,414,1796,Pure or high Gothic (imitation of OTRANTO),"Singer, Mr.",m,"THE MYSTIC CASTLE: OR, THE ORPHAN HEIR"
171,415,1798,"Pure or high Gothic (terror elements, Germanic elements and sublime topographies)","Sleath, Eleanor",f,THE ORPHAN OF THE RHINE. A ROMANCE
173,416,1802,Pure or high Gothic (terror elements),"Sleath, Eleanor",f,"WHO'S THE MURDERER? OR, THE MYSTERY OF THE FOREST"
170,417,1810,"Pure or high Gothic (horrific medievalism, situations from Walpole and Reeve)","Sleath, Eleanor",f,"THE NOCTURNAL MINSTREL, OR, THE SPIRIT OF THE WOOD"
172,418,1811,Pure or high Gothic (Radcliffean imitation),"Sleath, Eleanor",f,PYRENEAN BANDITTI. A ROMANCE
,419,1809,"Pure or high Gothic (terror mode, Radcliffean imitation)","Smith, Catharine",f,"THE CASTLE OF ARAGON: OR, THE BANDITTI OF THE FOREST"
174,420,1815,Pure or high Gothic (terror-horror modes),"Smith, Catharine",f,"BAROZZI, OR, THE VENETIAN SORCERESS. A ROMANCE OF THE SIXTEENTH CENTURY"
,421,1788,Sentimental Gothic (prominent features of the novel of terror),"Smith, Charlotte",f,"EMMELINE, THE ORPHAN OF THE CASTLE"
,422,1789,Sentimental Gothic (anticipates Radcliffean Gothic romance),"Smith, Charlotte",f,"ETHELINDE: OR, THE RECLUSE OF THE LAKE"
